<?xml version="1.0" encoding="UTF-8"?>
<tns:SimulationParameters xmlns:tns="http://www.example.org/SimulationSchema" xmlns:xsi="http://www.w3.org/2001/XMLSchema-instance" xsi:schemaLocation="http://www.example.org/SimulationSchema SimulationSchema.xsd ">
  <tns:initialConditions>
    <tns:modules>
      <tns:module>
        <tns:name>module1</tns:name>
        <tns:numberOfPieces>1</tns:numberOfPieces>
      </tns:module>
      <tns:module>
      	<tns:name>module2</tns:name>
      	<tns:numberOfPieces>1</tns:numberOfPieces>
      </tns:module>
    </tns:modules>
    <tns:simulationParameters>
      <tns:simulationSteps>1000</tns:simulationSteps>
      <tns:numberOfRepetitions>200</tns:numberOfRepetitions>
      <tns:timeScale>0.1</tns:timeScale>
    </tns:simulationParameters>
  </tns:initialConditions>
  <tns:bmFixedParameters>
    <tns:programmersInterest>
      <tns:submissionInterest>
        <tns:interest>0.0</tns:interest>
        <tns:interest>0.0</tns:interest>
      </tns:submissionInterest>
      <tns:debuggingInterest>
        <tns:interest>0.15</tns:interest>
        <tns:interest>0.15</tns:interest>
      </tns:debuggingInterest>
      <tns:testingInterest>
        <tns:interest>0.45</tns:interest>
        <tns:interest>0.45</tns:interest>
      </tns:testingInterest>
      <tns:functionalityInterest>
        <tns:interest>0.40</tns:interest>
        <tns:interest>0.40</tns:interest>
      </tns:functionalityInterest>
    </tns:programmersInterest>
    <tns:tasks>
      <tns:releaseFrequency>0.4</tns:releaseFrequency>
      <tns:locIncrementMean>0.4</tns:locIncrementMean>
      <tns:commitsMean>0.2</tns:commitsMean>
    </tns:tasks>
    <tns:calibration>
      <tns:commitsMean>10.0</tns:commitsMean>
      <tns:releasesMean>220.0</tns:releasesMean>
      <tns:contributorsMean>25.0</tns:contributorsMean>
      <tns:locIncremetsMean>220</tns:locIncremetsMean>
    </tns:calibration>
  </tns:bmFixedParameters>
  <tns:bmProjectParameters>
    <tns:aParameters>
      <tns:coreContributors>7</tns:coreContributors>
      <tns:halfLifeOfProgrammersInterest>246.0</tns:halfLifeOfProgrammersInterest>
      <tns:halfLifesStDev>213.0</tns:halfLifesStDev>
    </tns:aParameters>
    <tns:bParameters>
      <tns:qZero>1</tns:qZero>
    </tns:bParameters>
    <tns:cParameters>
      <tns:projectReleaseInterval>60</tns:projectReleaseInterval>
    </tns:cParameters>
  </tns:bmProjectParameters>
  <tns:pdParameters>
    <tns:linesOfCodeParameters>
      <tns:ModulesLOCMean>
        <tns:moduleLOCMean>1000</tns:moduleLOCMean>
        <tns:moduleLOCMean>1000</tns:moduleLOCMean>
      </tns:ModulesLOCMean>
      <tns:ModulesLOCStDev>
        <tns:moduleLOCStDev>2000</tns:moduleLOCStDev>
        <tns:moduleLOCStDev>2000</tns:moduleLOCStDev>
      </tns:ModulesLOCStDev>
      <tns:CompletedLOCMean>
        <tns:completedLOCMean>5000.0</tns:completedLOCMean>
        <tns:completedLOCMean>5000.0</tns:completedLOCMean>
      </tns:CompletedLOCMean>
      <tns:CompletedLOCStDev>
        <tns:completedLOCStDev>1000.0</tns:completedLOCStDev>
        <tns:completedLOCStDev>1000.0</tns:completedLOCStDev>
      </tns:CompletedLOCStDev>
      <tns:FuncImpLOCMean>
        <tns:funcImpLOCMean>27.0</tns:funcImpLOCMean>
        <tns:funcImpLOCMean>27.0</tns:funcImpLOCMean>
      </tns:FuncImpLOCMean>
      <tns:FuncImpLOCStDev>
        <tns:funcImpLOCStDev>115.0</tns:funcImpLOCStDev>
        <tns:funcImpLOCStDev>115.0</tns:funcImpLOCStDev>
      </tns:FuncImpLOCStDev>
    </tns:linesOfCodeParameters>
    <tns:bugsParameters>
      <tns:BugsPerLOCMean>0.004</tns:BugsPerLOCMean>
      <tns:BugsPerLOCStDev>0.003</tns:BugsPerLOCStDev>
      <tns:TimeMeanPerLOCSubmission>0.0117</tns:TimeMeanPerLOCSubmission>
      <tns:TimeStDevPerLOCSubmission>0.0387</tns:TimeStDevPerLOCSubmission>
      <tns:BugfixTimeMean>1.0</tns:BugfixTimeMean>
      <tns:BugFixTimeStDev>3.0</tns:BugFixTimeStDev>
    </tns:bugsParameters>
    <tns:testsParameters>
      <tns:testingTimeMean>0.1</tns:testingTimeMean>
      <tns:testingTimeStDev>0.2</tns:testingTimeStDev>
    </tns:testsParameters>
  </tns:pdParameters>
</tns:SimulationParameters>
